{"questions":[],"requested_changes":[],"responses_to_findings":[],"schema_version":1,"steps": [  { "actions": [ "placeholder" ], "criterion_ids": [ "R-001.C1" ], "depends_on": [], "id": "S-001", "objective": "placeholder", "requirement_ids": [ "R-001" ], "risks": [], "rollback_or_why_not_applicable": "placeholder", "targets": [], "title": "placeholder", "verification": [ { "expected": "placeholder", "id": "V-001", "method": "inspect", "repo_id": "placeholder" } ] } ]}